{
  "$schema": "http://json-schema.org/draft-07/schema#",
  "$id": "https://world-of-shadows.local/schemas/goc_g9b_evaluator_b_declaration_v1.json",
  "title": "GoC G9B Evaluator B declaration",
  "description": "Structured declaration for Evaluator B scoring pass. Per docs/plans/PLAN_G9B_REAL_INDEPENDENT_EVALUATOR_B.md §5, pre_scoring_visibility_statement is normatively mandatory for new submissions (exactly what B was/was not allowed to see before raw scoring). visibility_before_scoring may carry the same text if preferred. task_b_independence_class is set only after Task B review (§11): strict_blind | documented_exception | contaminated.",
  "type": "object",
  "required": [
    "schema",
    "roadmap_reference",
    "audit_run_id",
    "evaluator_b_id",
    "scored_at_utc"
  ],
  "additionalProperties": true,
  "properties": {
    "schema": {
      "type": "string",
      "enum": ["goc_g9b_evaluator_b_declaration_v1"]
    },
    "roadmap_reference": {
      "type": "string",
      "minLength": 1
    },
    "audit_run_id": {
      "type": "string",
      "minLength": 1
    },
    "evaluator_b_id": {
      "type": "string",
      "minLength": 1
    },
    "scoring_pass_label": {
      "type": "string"
    },
    "scored_at_utc": {
      "type": "string",
      "minLength": 1
    },
    "pre_scoring_visibility_statement": {
      "type": "string",
      "minLength": 1,
      "description": "Mandatory for new Evaluator B packages: explicit record of visibility before raw scoring (A matrix, A rationales, deltas, etc.)."
    },
    "visibility_before_scoring": {
      "type": "string",
      "minLength": 1,
      "description": "Optional alias for pre_scoring_visibility_statement; at least one of the two must be non-empty for PLAN_G9B compliance."
    },
    "task_b_independence_class": {
      "type": "string",
      "description": "Assigned during repo Task B review only.",
      "enum": ["strict_blind", "documented_exception", "contaminated"]
    },
    "evaluator_a_matrix_ref": {
      "type": "string"
    },
    "evaluator_b_matrix_ref": {
      "type": "string"
    },
    "independence_assessment": {
      "type": "string"
    },
    "level_b_readiness": {
      "type": "string"
    },
    "source_grounding": {
      "type": "object"
    },
    "score_delta_record_ref": {
      "type": "string"
    },
    "independence_and_process": {
      "type": "object"
    }
  }
}
