{
  "schema": "goc_g9b_evaluator_b_declaration_v1",
  "roadmap_reference": "docs/ROADMAP_MVP_GoC.md section 6.10",
  "audit_run_id": "g9_level_a_fullsix_20260410",
  "evaluator_b_id": "REPLACE_WITH_STABLE_ID_EG_ORGNAME_YYYYMMDD",
  "scoring_pass_label": "evaluator_b_external_independent_raw_matrix",
  "scored_at_utc": "REPLACE_WITH_ISO8601_UTC_WHEN_RAW_SCORING_COMPLETE",
  "pre_scoring_visibility_statement": "REQUIRED: Replace this entire string with a factual account of what you were and were not allowed to see before you began entering scores and cell_rationales. Explicitly address: (1) Evaluator A matrix g9_experience_score_matrix.json — seen or not; (2) Evaluator A per-cell rationales — seen or not; (3) any A-vs-B delta or reconciliation material — seen or not; (4) any prior Evaluator B matrix in the repository — seen or not. If any exception was approved, name who approved it and when.",
  "evaluator_a_matrix_ref": "",
  "evaluator_b_matrix_ref": "./g9_experience_score_matrix_evaluator_b.json",
  "independence_assessment": "REPLACE: e.g. human_external_independent | human_same_org_separate_analyst | isolated_automated_workflow — must be consistent with pre_scoring_visibility_statement. Do not claim roadmap Level B independence unless your process truly satisfies it.",
  "level_b_readiness": "not_claimed",
  "source_grounding": {
    "primary_evidence": "Frozen scenario JSON files supplied in the handoff package for audit_run_id g9_level_a_fullsix_20260410.",
    "scenario_filenames_scored": [
      "scenario_goc_roadmap_s1_direct_provocation.json",
      "scenario_goc_roadmap_s2_deflection_brevity.json",
      "scenario_goc_roadmap_s3_pressure_escalation.json",
      "scenario_goc_roadmap_s4_misinterpretation_correction.json",
      "scenario_goc_roadmap_s5_primary_failure_fallback.json",
      "scenario_goc_roadmap_s6_retrieval_heavy.json"
    ],
    "actual_script_pdf_path_rel": "resources/Script-God-Of-Carnage-Script-by-Yazmina-Reza.pdf",
    "script_grounding_note": "REPLACE: State whether you used the PDF; if yes, how it informed expectations (tone, status, escalation) without inventing lines not in the JSON.",
    "supplementary_repo_sources_used": [],
    "supplementary_repo_sources_allowed_but_not_used": [
      "content/modules/god_of_carnage/",
      "docs/CANONICAL_TURN_CONTRACT_GOC.md"
    ]
  },
  "score_delta_record_ref": "",
  "independence_and_process": {
    "evaluator_role_type": "REPLACE: e.g. second_human_adjudicator | external_contract_reviewer | other",
    "authorship_of_handoff_instructions": "REPLACE: who authored the instruction package you received",
    "who_generated_scores_and_rationales": "REPLACE: your name or pseudonymous id",
    "process_note": "REPLACE: steps taken (tools, sessions, breaks), order of work, when raw matrix was frozen",
    "authorship_process_separation_note": "REPLACE: confirm instruction author vs scorer separation as applicable",
    "english_limitation_statement": "REPLACE: constraints (time, language, partial PDF read, no repo access, etc.)",
    "no_level_b_closure_claim": true,
    "no_g10_or_mvp_closure_claim": true,
    "evaluator_a_artifacts_unmodified_declaration": true
  }
}
